{
  "schemaVersion": "1.0.0",
  "generatedAt": "2026-05-23T20:58:42.030Z",
  "engineVersion": "0.2.0",
  "engineMethod": "neher-mcgrath-1957",
  "catalogVersion": "cigre-tb880",
  "summary": {
    "total": 68,
    "active": 55,
    "passing": 55,
    "expectedFail": 0,
    "skipped": 13,
    "failing": 0
  },
  "cases": [
    {
      "id": "cigre-tb880-0-1-buried-trefoil",
      "title": "CIGRE TB 880 Case #0-1 - 132 kV Cu/XLPE/Al-foil/PE, directly buried touching trefoil",
      "citation": "CIGRE TB 880 (Sep 2022), Section 4.5.1 (input data) and Section 4.6.4 (converged result), Case #0-1",
      "sourceType": "cigre-tb880",
      "page": "Section 4.5.1 / 4.6.4 / Table 4-2",
      "tags": [
        "cigre-tb880",
        "trefoil",
        "direct-buried",
        "hv"
      ],
      "status": "active",
      "pass": true,
      "skipReason": null,
      "pdfUrl": "https://github.com/deliverable-labs/cable-sketch-validation/releases/download/v0.1.6/cigre-tb880-0-1-buried-trefoil.pdf",
      "engineVersion": "0.2.0",
      "engineMethod": "neher-mcgrath-1957",
      "catalogVersion": "cigre-tb880",
      "computedAt": "2026-05-23T20:58:41.980Z",
      "expectations": [
        {
          "path": "conduits.cir-1-top.resistances.t1KmPerW",
          "expected": 0.41987,
          "actual": 0.4198714890343629,
          "toleranceAbs": null,
          "toleranceRel": 0.005,
          "deviationPercent": 0.0004,
          "marginUsed": 0.07,
          "pass": true,
          "note": "Engine sums per-sub-layer (1.5 mm SC rho=2.5, 15.5 mm XLPE rho=3.5, 1.3 mm SC rho=2.5) per CIGRE TB 880 p83 / IEC 60287-2-1 §4.1.2. Lands at 0.41987 vs spec 0.4199 (0.003 % off)."
        },
        {
          "path": "conduits.cir-1-top.losses.dielectricWPerM",
          "expected": 0.3851,
          "actual": 0.3849690687828983,
          "toleranceAbs": null,
          "toleranceRel": 0.005,
          "deviationPercent": -0.034,
          "marginUsed": 6.8,
          "pass": true,
          "note": "Wd hits the spec to <0.1 % thanks to the back-solved epsilon in the fixture."
        },
        {
          "path": "conduits.cir-1-top.resistances.t3KmPerW",
          "expected": 0.08672,
          "actual": 0.08671937478964181,
          "toleranceAbs": null,
          "toleranceRel": 0.005,
          "deviationPercent": -0.0007,
          "marginUsed": 0.14,
          "pass": true,
          "note": "T3 base 0.0542 * 1.6 = 0.0867 with the IEC 60287-2-1 4.2.4.3.2 buried touching-trefoil multiplier."
        },
        {
          "path": "conduits.cir-1-top.losses.sheathLossFactorLambda1",
          "expected": 0.36629,
          "actual": 0.36774301875209936,
          "toleranceAbs": null,
          "toleranceRel": 0.03,
          "deviationPercent": 0.3967,
          "marginUsed": 13.22,
          "pass": true,
          "note": "Spec lambda1 = Yc 0.29348 (circ) + Yse 0.07282 (eddy). Engine implements Yc per NM 1957 eq. 14 plus Yse per eq. 30A with the bonded-sheath correction Rs^2/(Rs^2+Xm^2); converges on 0.367 (~0.3 % high)."
        },
        {
          "path": "conduits.cir-1-top.ampacityAmps",
          "expected": 803.16,
          "actual": 802.6,
          "toleranceAbs": null,
          "toleranceRel": 0.02,
          "deviationPercent": -0.0697,
          "marginUsed": 3.49,
          "pass": true,
          "note": "10-digit reference 803.1596 A."
        }
      ]
    },
    {
      "id": "cigre-tb880-0-2-hdpe-trefoil",
      "title": "CIGRE TB 880 Case #0-2 - 132 kV trefoil in touching HDPE ducts (no concrete)",
      "citation": "CIGRE TB 880 (Sep 2022), Section 4.7 (input data) and Section 4.7.7 (converged result), Case #0-2",
      "sourceType": "cigre-tb880",
      "page": "Section 4.7 / Table 4-2",
      "tags": [
        "cigre-tb880",
        "trefoil",
        "ducts",
        "hv"
      ],
      "status": "active",
      "pass": true,
      "skipReason": null,
      "pdfUrl": "https://github.com/deliverable-labs/cable-sketch-validation/releases/download/v0.1.6/cigre-tb880-0-2-hdpe-trefoil.pdf",
      "engineVersion": "0.2.0",
      "engineMethod": "neher-mcgrath-1957",
      "catalogVersion": "cigre-tb880",
      "computedAt": "2026-05-23T20:58:41.982Z",
      "expectations": [
        {
          "path": "conduits.cir-1-top.resistances.t1KmPerW",
          "expected": 0.41987,
          "actual": 0.4198714890343629,
          "toleranceAbs": null,
          "toleranceRel": 0.005,
          "deviationPercent": 0.0004,
          "marginUsed": 0.07,
          "pass": true,
          "note": null
        },
        {
          "path": "conduits.cir-1-top.resistances.t4DoublePrimeKmPerW",
          "expected": 0.08866,
          "actual": 0.0886606471945467,
          "toleranceAbs": null,
          "toleranceRel": 0.005,
          "deviationPercent": 0.0007,
          "marginUsed": 0.15,
          "pass": true,
          "note": "T4'' = rho_HDPE/(2*pi) * ln(140/119.4); exact match."
        },
        {
          "path": "conduits.cir-1-top.losses.dielectricWPerM",
          "expected": 0.3851,
          "actual": 0.3849690687828983,
          "toleranceAbs": null,
          "toleranceRel": 0.005,
          "deviationPercent": -0.034,
          "marginUsed": 6.8,
          "pass": true,
          "note": null
        },
        {
          "path": "conduits.cir-1-top.resistances.t3KmPerW",
          "expected": 0.08672,
          "actual": 0.08671937478964181,
          "toleranceAbs": null,
          "toleranceRel": 0.005,
          "deviationPercent": -0.0007,
          "marginUsed": 0.14,
          "pass": true,
          "note": "T3 base 0.0542 * 1.6 = 0.0867 with the IEC 60287-2-1 4.2.4.3.2 buried touching-trefoil multiplier (engine treats touching ducts as touching trefoil)."
        },
        {
          "path": "conduits.cir-1-top.losses.sheathLossFactorLambda1",
          "expected": 0.85246,
          "actual": 0.8520148580332697,
          "toleranceAbs": null,
          "toleranceRel": 0.03,
          "deviationPercent": -0.0522,
          "marginUsed": 1.74,
          "pass": true,
          "note": "Engine NM 1957 Yc gives 0.835 (~2 % low vs spec 0.852). Eddy term Y_s not implemented but is small here because the ducts space the cables out."
        },
        {
          "path": "conduits.cir-1-top.ampacityAmps",
          "expected": 679.84,
          "actual": 674.9,
          "toleranceAbs": null,
          "toleranceRel": 0.02,
          "deviationPercent": -0.7266,
          "marginUsed": 36.33,
          "pass": true,
          "note": "10-digit reference 679.8410 A. Engine reports ~675 A (0.7 % low)."
        }
      ]
    },
    {
      "id": "cigre-tb880-0-3-pvc-concrete-flat",
      "title": "CIGRE TB 880 Case #0-3 - 132 kV flat formation in PVC ducts inside concrete envelope",
      "citation": "CIGRE TB 880 (Sep 2022), Section 4.8 (input data) and Section 4.8.6 (converged result), Case #0-3",
      "sourceType": "cigre-tb880",
      "page": "Section 4.8 / Table 4-2",
      "tags": [
        "cigre-tb880",
        "flat",
        "ducts",
        "concrete",
        "multi-rho",
        "hv"
      ],
      "status": "active",
      "pass": true,
      "skipReason": null,
      "pdfUrl": "https://github.com/deliverable-labs/cable-sketch-validation/releases/download/v0.1.6/cigre-tb880-0-3-pvc-concrete-flat.pdf",
      "engineVersion": "0.2.0",
      "engineMethod": "neher-mcgrath-1957",
      "catalogVersion": "cigre-tb880",
      "computedAt": "2026-05-23T20:58:41.983Z",
      "expectations": [
        {
          "path": "conduits.cir-1-lagging.resistances.t1KmPerW",
          "expected": 0.41987,
          "actual": 0.4198714890343629,
          "toleranceAbs": null,
          "toleranceRel": 0.005,
          "deviationPercent": 0.0004,
          "marginUsed": 0.07,
          "pass": true,
          "note": null
        },
        {
          "path": "conduits.cir-1-lagging.resistances.t3KmPerW",
          "expected": 0.0542,
          "actual": 0.05419960924352613,
          "toleranceAbs": null,
          "toleranceRel": 0.005,
          "deviationPercent": -0.0007,
          "marginUsed": 0.14,
          "pass": true,
          "note": "Base T3 (no x1.6) because flat formation is non-trefoil."
        },
        {
          "path": "conduits.cir-1-lagging.resistances.t4DoublePrimeKmPerW",
          "expected": 0.05019,
          "actual": 0.050188477502282704,
          "toleranceAbs": null,
          "toleranceRel": 0.005,
          "deviationPercent": -0.003,
          "marginUsed": 0.61,
          "pass": true,
          "note": "T4'' = rho_PVC/(2*pi) * ln(125/118.6) with rho_PVC = 6 K.m/W."
        },
        {
          "path": "conduits.cir-1-lagging.losses.dielectricWPerM",
          "expected": 0.3851,
          "actual": 0.3849690687828983,
          "toleranceAbs": null,
          "toleranceRel": 0.005,
          "deviationPercent": -0.034,
          "marginUsed": 6.8,
          "pass": true,
          "note": null
        },
        {
          "path": "conduits.cir-1-lagging.losses.sheathLossFactorLambda1",
          "expected": 1.7105,
          "actual": 1.7129921230704837,
          "toleranceAbs": null,
          "toleranceRel": 0.05,
          "deviationPercent": 0.1457,
          "marginUsed": 2.91,
          "pass": true,
          "note": "Per-position closed form (CIGRE p93 / IEC 60287-1-1 sec 2.3.3): lagging outer lambda'11 = 1.7105 (first iteration at 80 C). Engine converges at ~1.71 within 0.5 percent."
        },
        {
          "path": "conduits.cir-1-central.losses.sheathLossFactorLambda1",
          "expected": 0.7748,
          "actual": 0.8134532126079533,
          "toleranceAbs": null,
          "toleranceRel": 0.05,
          "deviationPercent": 4.9888,
          "marginUsed": 99.78,
          "pass": true,